{
  "resourceType" : "StructureDefinition",
  "id" : "pfe-nutrition-order",
  "text" : {
    "status" : "extensions",
    "div" : "<div xmlns=\"http://www.w3.org/1999/xhtml\"><p class=\"res-header-id\"><b>Generated Narrative: StructureDefinition pfe-nutrition-order</b></p><a name=\"pfe-nutrition-order\"> </a><a name=\"hcpfe-nutrition-order\"> </a><a name=\"pfe-nutrition-order-en-US\"> </a><table border=\"0\" cellpadding=\"0\" cellspacing=\"0\" style=\"border: 0px #F0F0F0 solid; font-size: 11px; font-family: verdana; vertical-align: top;\"><tr style=\"border: 1px #F0F0F0 solid; font-size: 11px; font-family: verdana; vertical-align: top\"><th style=\"vertical-align: top; text-align : left; background-color: white; border: 0px #F0F0F0 solid; padding:0px 4px 0px 4px\" class=\"hierarchy\"><a href=\"https://build.fhir.org/ig/FHIR/ig-guidance/readingIgs.html#table-views\" title=\"The logical name of the element\">Name</a></th><th style=\"vertical-align: top; text-align : left; background-color: white; border: 0px #F0F0F0 solid; padding:0px 4px 0px 4px\" class=\"hierarchy\"><a href=\"https://build.fhir.org/ig/FHIR/ig-guidance/readingIgs.html#table-views\" title=\"Information about the use of the element\">Flags</a></th><th style=\"vertical-align: top; text-align : left; background-color: white; border: 0px #F0F0F0 solid; padding:0px 4px 0px 4px\" class=\"hierarchy\"><a href=\"https://build.fhir.org/ig/FHIR/ig-guidance/readingIgs.html#table-views\" title=\"Minimum and Maximum # of times the element can appear in the instance\">Card.</a></th><th style=\"width: 100px\" class=\"hierarchy\"><a href=\"https://build.fhir.org/ig/FHIR/ig-guidance/readingIgs.html#table-views\" title=\"Reference to the type of the element\">Type</a></th><th style=\"vertical-align: top; text-align : left; background-color: white; border: 0px #F0F0F0 solid; padding:0px 4px 0px 4px\" class=\"hierarchy\"><a href=\"https://build.fhir.org/ig/FHIR/ig-guidance/readingIgs.html#table-views\" title=\"Additional information about the element\">Description &amp; Constraints</a><span style=\"float: right\"><a href=\"https://build.fhir.org/ig/FHIR/ig-guidance/readingIgs.html#table-views\" title=\"Legend for this format\"><img src=\"data:image/png;base64,iVBORw0KGgoAAAANSUhEUgAAABAAAAAQCAYAAAAf8/9hAAAABmJLR0QA/wD/AP+gvaeTAAAACXBIWXMAAAsTAAALEwEAmpwYAAAAB3RJTUUH3goXBCwdPqAP0wAAAldJREFUOMuNk0tIlFEYhp9z/vE2jHkhxXA0zJCMitrUQlq4lnSltEqCFhFG2MJFhIvIFpkEWaTQqjaWZRkp0g26URZkTpbaaOJkDqk10szoODP//7XIMUe0elcfnPd9zsfLOYplGrpRwZaqTtw3K7PtGem7Q6FoidbGgqHVy/HRb669R+56zx7eRV1L31JGxYbBtjKK93cxeqfyQHbehkZbUkK20goELEuIzEd+dHS+qz/Y8PTSif0FnGkbiwcAjHaU1+QWOptFiyCLp/LnKptpqIuXHx6rbR26kJcBX3yLgBfnd7CxwJmflpP2wUg0HIAoUUpZBmKzELGWcN8nAr6Gpu7tLU/CkwAaoKTWRSQyt89Q8w6J+oVQkKnBoblH7V0PPvUOvDYXfopE/SJmALsxnVm6LbkotrUtNowMeIrVrBcBpaMmdS0j9df7abpSuy7HWehwJdt1lhVwi/J58U5beXGAF6c3UXLycw1wdFklArBn87xdh0ZsZtArghBdAA3+OEDVubG4UEzP6x1FOWneHh2VDAHBAt80IbdXDcesNoCvs3E5AFyNSU5nbrDPZpcUEQQTFZiEVx+51fxMhhyJEAgvlriadIJZZksRuwBYMOPBbO3hePVVqgEJhFeUuFLhIPkRP6BQLIBrmMenujm/3g4zc398awIe90Zb5A1vREALqneMcYgP/xVQWlG+Ncu5vgwwlaUNx+3799rfe96u9K0JSDXcOzOTJg4B6IgmXfsygc7/Bvg9g9E58/cDVmGIBOP/zT8Bz1zqWqpbXIsd0O9hajXfL6u4BaOS6SeWAAAAAElFTkSuQmCC\" alt=\"doco\" style=\"background-color: inherit\"/></a></span></th></tr><tr style=\"border: 0px #F0F0F0 solid; padding:0px; vertical-align: top; background-color: white\"><td style=\"vertical-align: top; text-align : left; background-color: white; border: 0px #F0F0F0 solid; padding:0px 4px 0px 4px; white-space: nowrap; background-image: url(tbl_bck1.png)\" class=\"hierarchy\"><img src=\"tbl_spacer.png\" alt=\".\" style=\"background-color: inherit\" class=\"hierarchy\"/><img src=\"icon_resource.png\" alt=\".\" style=\"background-color: white; background-color: inherit\" title=\"Resource\" class=\"hierarchy\"/> <a href=\"StructureDefinition-pfe-nutrition-order-definitions.html#NutritionOrder\">NutritionOrder</a><a name=\"NutritionOrder\"> </a></td><td style=\"vertical-align: top; text-align : left; background-color: white; border: 0px #F0F0F0 solid; padding:0px 4px 0px 4px\" class=\"hierarchy\"/><td style=\"vertical-align: top; text-align : left; background-color: white; border: 0px #F0F0F0 solid; padding:0px 4px 0px 4px\" class=\"hierarchy\"><span style=\"opacity: 0.5\">0</span><span style=\"opacity: 0.5\">..</span><span style=\"opacity: 0.5\">*</span></td><td style=\"vertical-align: top; text-align : left; background-color: white; border: 0px #F0F0F0 solid; padding:0px 4px 0px 4px\" class=\"hierarchy\"><a href=\"http://hl7.org/fhir/R4/nutritionorder.html\">NutritionOrder</a></td><td style=\"vertical-align: top; text-align : left; background-color: white; border: 0px #F0F0F0 solid; padding:0px 4px 0px 4px\" class=\"hierarchy\"><span style=\"opacity: 0.5\">Diet, formula or nutritional supplement request</span></td></tr>\r\n<tr style=\"border: 0px #F0F0F0 solid; padding:0px; vertical-align: top; background-color: #F7F7F7\"><td style=\"vertical-align: top; text-align : left; background-color: #F7F7F7; border: 0px #F0F0F0 solid; padding:0px 4px 0px 4px; white-space: nowrap; background-image: url(tbl_bck10.png)\" class=\"hierarchy\"><img src=\"tbl_spacer.png\" alt=\".\" style=\"background-color: inherit\" class=\"hierarchy\"/><img src=\"tbl_vjoin.png\" alt=\".\" style=\"background-color: inherit\" class=\"hierarchy\"/><img src=\"icon_element.gif\" alt=\".\" style=\"background-color: #F7F7F7; background-color: inherit\" title=\"Element\" class=\"hierarchy\"/> <a href=\"StructureDefinition-pfe-nutrition-order-definitions.html#NutritionOrder.encounter\">encounter</a><a name=\"NutritionOrder.encounter\"> </a></td><td style=\"vertical-align: top; text-align : left; background-color: #F7F7F7; border: 0px #F0F0F0 solid; padding:0px 4px 0px 4px\" class=\"hierarchy\"><span style=\"padding-left: 3px; padding-right: 3px; color: white; background-color: red\" title=\"This element must be supported\">S</span></td><td style=\"vertical-align: top; text-align : left; background-color: #F7F7F7; border: 0px #F0F0F0 solid; padding:0px 4px 0px 4px\" class=\"hierarchy\"><span style=\"opacity: 0.5\">0</span><span style=\"opacity: 0.5\">..</span><span style=\"opacity: 0.5\">1</span></td><td style=\"vertical-align: top; text-align : left; background-color: #F7F7F7; border: 0px #F0F0F0 solid; padding:0px 4px 0px 4px\" class=\"hierarchy\"><a href=\"http://hl7.org/fhir/R4/references.html\">Reference</a>(<a style=\"opacity: 0.5\" href=\"http://hl7.org/fhir/R4/encounter.html\">Encounter</a>)</td><td style=\"vertical-align: top; text-align : left; background-color: #F7F7F7; border: 0px #F0F0F0 solid; padding:0px 4px 0px 4px\" class=\"hierarchy\"><span style=\"opacity: 0.5\">The encounter associated with this nutrition order</span></td></tr>\r\n<tr style=\"border: 0px #F0F0F0 solid; padding:0px; vertical-align: top; background-color: white\"><td style=\"vertical-align: top; text-align : left; background-color: white; border: 0px #F0F0F0 solid; padding:0px 4px 0px 4px; white-space: nowrap; background-image: url(tbl_bck10.png)\" class=\"hierarchy\"><img src=\"tbl_spacer.png\" alt=\".\" style=\"background-color: inherit\" class=\"hierarchy\"/><img src=\"tbl_vjoin.png\" alt=\".\" style=\"background-color: inherit\" class=\"hierarchy\"/><img src=\"icon_element.gif\" alt=\".\" style=\"background-color: white; background-color: inherit\" title=\"Element\" class=\"hierarchy\"/> <a href=\"StructureDefinition-pfe-nutrition-order-definitions.html#NutritionOrder.orderer\">orderer</a><a name=\"NutritionOrder.orderer\"> </a></td><td style=\"vertical-align: top; text-align : left; background-color: white; border: 0px #F0F0F0 solid; padding:0px 4px 0px 4px\" class=\"hierarchy\"><span style=\"padding-left: 3px; padding-right: 3px; color: white; background-color: red\" title=\"This element must be supported\">S</span></td><td style=\"vertical-align: top; text-align : left; background-color: white; border: 0px #F0F0F0 solid; padding:0px 4px 0px 4px\" class=\"hierarchy\"><span style=\"opacity: 0.5\">0</span><span style=\"opacity: 0.5\">..</span><span style=\"opacity: 0.5\">1</span></td><td style=\"vertical-align: top; text-align : left; background-color: white; border: 0px #F0F0F0 solid; padding:0px 4px 0px 4px\" class=\"hierarchy\"><a href=\"http://hl7.org/fhir/R4/references.html\">Reference</a>(<a style=\"opacity: 0.5\" href=\"http://hl7.org/fhir/R4/practitioner.html\">Practitioner</a> | <a style=\"opacity: 0.5\" href=\"http://hl7.org/fhir/R4/practitionerrole.html\">PractitionerRole</a>)</td><td style=\"vertical-align: top; text-align : left; background-color: white; border: 0px #F0F0F0 solid; padding:0px 4px 0px 4px\" class=\"hierarchy\"><span style=\"opacity: 0.5\">Who ordered the diet, formula or nutritional supplement</span></td></tr>\r\n<tr style=\"border: 0px #F0F0F0 solid; padding:0px; vertical-align: top; background-color: #F7F7F7\"><td style=\"vertical-align: top; text-align : left; background-color: #F7F7F7; border: 0px #F0F0F0 solid; padding:0px 4px 0px 4px; white-space: nowrap; background-image: url(tbl_bck10.png)\" class=\"hierarchy\"><img src=\"tbl_spacer.png\" alt=\".\" style=\"background-color: inherit\" class=\"hierarchy\"/><img src=\"tbl_vjoin.png\" alt=\".\" style=\"background-color: inherit\" class=\"hierarchy\"/><img src=\"icon_element.gif\" alt=\".\" style=\"background-color: #F7F7F7; background-color: inherit\" title=\"Element\" class=\"hierarchy\"/> <a href=\"StructureDefinition-pfe-nutrition-order-definitions.html#NutritionOrder.allergyIntolerance\">allergyIntolerance</a><a name=\"NutritionOrder.allergyIntolerance\"> </a></td><td style=\"vertical-align: top; text-align : left; background-color: #F7F7F7; border: 0px #F0F0F0 solid; padding:0px 4px 0px 4px\" class=\"hierarchy\"/><td style=\"vertical-align: top; text-align : left; background-color: #F7F7F7; border: 0px #F0F0F0 solid; padding:0px 4px 0px 4px\" class=\"hierarchy\">1..<span style=\"opacity: 0.5\">*</span></td><td style=\"vertical-align: to